[
  {
    "customer_key": "cus_anh-b-nh-n-i-s-p",
    "name": "Anh Bình (Núi Sập)",
    "master_source": "kiotviet",
    "kiotviet_customer_id": null,
    "legacy_detected_from": "warranty_items.csv"
  },
  {
    "customer_key": "cus_anh-b-o-g-v-p",
    "name": "Anh Bảo (Gò Vấp)",
    "master_source": "kiotviet",
    "kiotviet_customer_id": null,
    "legacy_detected_from": "warranty_items.csv"
  },
  {
    "customer_key": "cus_anh-chanh-h-n-i",
    "name": "Anh Chanh (Hà Nội)",
    "master_source": "kiotviet",
    "kiotviet_customer_id": null,
    "legacy_detected_from": "warranty_items.csv"
  },
  {
    "customer_key": "cus_anh-chi-n",
    "name": "Anh Chiến",
    "master_source": "kiotviet",
    "kiotviet_customer_id": null,
    "legacy_detected_from": "warranty_items.csv"
  },
  {
    "customer_key": "cus_anh-ch-ng-ti-n-giang",
    "name": "Anh Chương (Tiền Giang)",
    "master_source": "kiotviet",
    "kiotviet_customer_id": null,
    "legacy_detected_from": "warranty_items.csv"
  },
  {
    "customer_key": "cus_anh-c-ng-h-u",
    "name": "Anh Công Hữu",
    "master_source": "kiotviet",
    "kiotviet_customer_id": null,
    "legacy_detected_from": "warranty_items.csv"
  },
  {
    "customer_key": "cus_anh-c-ng",
    "name": "Anh Cường",
    "master_source": "kiotviet",
    "kiotviet_customer_id": null,
    "legacy_detected_from": "warranty_items.csv"
  },
  {
    "customer_key": "cus_anh-c-ng-0913806080",
    "name": "Anh Cường - 0913806080",
    "master_source": "kiotviet",
    "kiotviet_customer_id": null,
    "legacy_detected_from": "warranty_items.csv"
  },
  {
    "customer_key": "cus_anh-c-ng-l",
    "name": "Anh Cường Lê",
    "master_source": "kiotviet",
    "kiotviet_customer_id": null,
    "legacy_detected_from": "warranty_items.csv"
  },
  {
    "customer_key": "cus_anh-duy",
    "name": "Anh Duy",
    "master_source": "kiotviet",
    "kiotviet_customer_id": null,
    "legacy_detected_from": "warranty_items.csv"
  },
  {
    "customer_key": "cus_anh-duy-phan-rang",
    "name": "Anh Duy (Phan Rang)",
    "master_source": "kiotviet",
    "kiotviet_customer_id": null,
    "legacy_detected_from": "warranty_items.csv"
  },
  {
    "customer_key": "cus_anh-duy-ph-y-n",
    "name": "Anh Duy (Phú Yên)",
    "master_source": "kiotviet",
    "kiotviet_customer_id": null,
    "legacy_detected_from": "warranty_items.csv"
  },
  {
    "customer_key": "cus_anh-duy-ng-th-p",
    "name": "Anh Duy (Đồng Tháp)",
    "master_source": "kiotviet",
    "kiotviet_customer_id": null,
    "legacy_detected_from": "warranty_items.csv"
  },
  {
    "customer_key": "cus_anh-d-ng-b-c-li-u",
    "name": "Anh Dương (Bạc Liêu)",
    "master_source": "kiotviet",
    "kiotviet_customer_id": null,
    "legacy_detected_from": "warranty_items.csv"
  },
  {
    "customer_key": "cus_anh-giang-diamond",
    "name": "Anh Giang (Diamond)",
    "master_source": "kiotviet",
    "kiotviet_customer_id": null,
    "legacy_detected_from": "warranty_items.csv"
  },
  {
    "customer_key": "cus_anh-hi-u-q-9",
    "name": "Anh Hiếu (Q.9)",
    "master_source": "kiotviet",
    "kiotviet_customer_id": null,
    "legacy_detected_from": "warranty_items.csv"
  },
  {
    "customer_key": "cus_anh-ho-ng-t-n-b-nh",
    "name": "Anh Hoàng (Tân Bình)",
    "master_source": "kiotviet",
    "kiotviet_customer_id": null,
    "legacy_detected_from": "warranty_items.csv"
  },
  {
    "customer_key": "cus_anh-ho-ng-gia-d-ng",
    "name": "Anh Hoàng Gia Dụng",
    "master_source": "kiotviet",
    "kiotviet_customer_id": null,
    "legacy_detected_from": "warranty_items.csv"
  },
  {
    "customer_key": "cus_anh-huy-b-c-li-u",
    "name": "Anh Huy (Bạc Liêu)",
    "master_source": "kiotviet",
    "kiotviet_customer_id": null,
    "legacy_detected_from": "warranty_items.csv"
  },
  {
    "customer_key": "cus_anh-h-o-ph-y-n",
    "name": "Anh Hào (Phú Yên)",
    "master_source": "kiotviet",
    "kiotviet_customer_id": null,
    "legacy_detected_from": "warranty_items.csv"
  },
  {
    "customer_key": "cus_anh-h-n",
    "name": "Anh Hân",
    "master_source": "kiotviet",
    "kiotviet_customer_id": null,
    "legacy_detected_from": "warranty_items.csv"
  },
  {
    "customer_key": "cus_anh-h-a-q-12",
    "name": "Anh Hòa (Q.12)",
    "master_source": "kiotviet",
    "kiotviet_customer_id": null,
    "legacy_detected_from": "warranty_items.csv"
  },
  {
    "customer_key": "cus_anh-h-ng-ki-n-giang",
    "name": "Anh Hùng (Kiên Giang)",
    "master_source": "kiotviet",
    "kiotviet_customer_id": null,
    "legacy_detected_from": "warranty_items.csv"
  },
  {
    "customer_key": "cus_anh-h-ng-l-c-t-n",
    "name": "Anh Hùng (Lộc Tấn)",
    "master_source": "kiotviet",
    "kiotviet_customer_id": null,
    "legacy_detected_from": "warranty_items.csv"
  },
  {
    "customer_key": "cus_anh-h-nh",
    "name": "Anh Hạnh",
    "master_source": "kiotviet",
    "kiotviet_customer_id": null,
    "legacy_detected_from": "warranty_items.csv"
  },
  {
    "customer_key": "cus_anh-h-i-v-ng-t-u",
    "name": "Anh Hải (Vũng Tàu)",
    "master_source": "kiotviet",
    "kiotviet_customer_id": null,
    "legacy_detected_from": "warranty_items.csv"
  },
  {
    "customer_key": "cus_anh-h-i-0945448443",
    "name": "Anh Hải - 0945448443",
    "master_source": "kiotviet",
    "kiotviet_customer_id": null,
    "legacy_detected_from": "warranty_items.csv"
  },
  {
    "customer_key": "cus_anh-h-u-q-12",
    "name": "Anh Hậu (Q.12)",
    "master_source": "kiotviet",
    "kiotviet_customer_id": null,
    "legacy_detected_from": "warranty_items.csv"
  },
  {
    "customer_key": "cus_anh-h-u-t-n-b-nh",
    "name": "Anh Hậu (Tân Bình)",
    "master_source": "kiotviet",
    "kiotviet_customer_id": null,
    "legacy_detected_from": "warranty_items.csv"
  },
  {
    "customer_key": "cus_anh-h-ng-ng-nai",
    "name": "Anh Hồng (Đồng Nai)",
    "master_source": "kiotviet",
    "kiotviet_customer_id": null,
    "legacy_detected_from": "warranty_items.csv"
  },
  {
    "customer_key": "cus_anh-h-p-q-7",
    "name": "Anh Hợp (Q.7)",
    "master_source": "kiotviet",
    "kiotviet_customer_id": null,
    "legacy_detected_from": "warranty_items.csv"
  },
  {
    "customer_key": "cus_anh-khang-ti-n-giang",
    "name": "Anh Khang (Tiền Giang)",
    "master_source": "kiotviet",
    "kiotviet_customer_id": null,
    "legacy_detected_from": "warranty_items.csv"
  },
  {
    "customer_key": "cus_anh-khi-m-g-v-p",
    "name": "Anh Khiêm (Gò Vấp)",
    "master_source": "kiotviet",
    "kiotviet_customer_id": null,
    "legacy_detected_from": "warranty_items.csv"
  },
  {
    "customer_key": "cus_anh-khoa-bi-n-h-a",
    "name": "Anh Khoa (Biên Hòa)",
    "master_source": "kiotviet",
    "kiotviet_customer_id": null,
    "legacy_detected_from": "warranty_items.csv"
  },
  {
    "customer_key": "cus_anh-khoa-b-nh-d-ng",
    "name": "Anh Khoa (Bình Dương)",
    "master_source": "kiotviet",
    "kiotviet_customer_id": null,
    "legacy_detected_from": "warranty_items.csv"
  },
  {
    "customer_key": "cus_anh-ki-t-an-giang",
    "name": "Anh Kiệt (An Giang)",
    "master_source": "kiotviet",
    "kiotviet_customer_id": null,
    "legacy_detected_from": "warranty_items.csv"
  },
  {
    "customer_key": "cus_anh-ki-t-ch-nh",
    "name": "Anh Kiệt chủ nhà",
    "master_source": "kiotviet",
    "kiotviet_customer_id": null,
    "legacy_detected_from": "warranty_items.csv"
  },
  {
    "customer_key": "cus_anh-li-m-b-n-tre",
    "name": "Anh Liêm (Bến Tre)",
    "master_source": "kiotviet",
    "kiotviet_customer_id": null,
    "legacy_detected_from": "warranty_items.csv"
  },
  {
    "customer_key": "cus_anh-l-m-h-o-b-nh-nh",
    "name": "Anh Lâm Hảo (Bình Định)",
    "master_source": "kiotviet",
    "kiotviet_customer_id": null,
    "legacy_detected_from": "warranty_items.csv"
  },
  {
    "customer_key": "cus_anh-l-n",
    "name": "Anh Lân",
    "master_source": "kiotviet",
    "kiotviet_customer_id": null,
    "legacy_detected_from": "warranty_items.csv"
  },
  {
    "customer_key": "cus_anh-l-v-n-t-n",
    "name": "Anh Lô Văn Tân",
    "master_source": "kiotviet",
    "kiotviet_customer_id": null,
    "legacy_detected_from": "warranty_items.csv"
  },
  {
    "customer_key": "cus_anh-l-c-q1",
    "name": "Anh Lộc (Q1)",
    "master_source": "kiotviet",
    "kiotviet_customer_id": null,
    "legacy_detected_from": "warranty_items.csv"
  },
  {
    "customer_key": "cus_anh-minh-qu-n-5",
    "name": "Anh Minh ( Quận 5 )",
    "master_source": "kiotviet",
    "kiotviet_customer_id": null,
    "legacy_detected_from": "warranty_items.csv"
  },
  {
    "customer_key": "cus_anh-minh-h-n-i",
    "name": "Anh Minh (Hà Nội)",
    "master_source": "kiotviet",
    "kiotviet_customer_id": null,
    "legacy_detected_from": "warranty_items.csv"
  },
  {
    "customer_key": "cus_anh-minh-th-c",
    "name": "Anh Minh (Thủ Đức)",
    "master_source": "kiotviet",
    "kiotviet_customer_id": null,
    "legacy_detected_from": "warranty_items.csv"
  },
  {
    "customer_key": "cus_anh-minh-ph-c-anh-h-nh-nha-trang",
    "name": "Anh Minh Phước (anh Hạnh Nha Trang)",
    "master_source": "kiotviet",
    "kiotviet_customer_id": null,
    "legacy_detected_from": "warranty_items.csv"
  },
  {
    "customer_key": "cus_anh-m-n-h",
    "name": "Anh Mến Hồ",
    "master_source": "kiotviet",
    "kiotviet_customer_id": null,
    "legacy_detected_from": "warranty_items.csv"
  },
  {
    "customer_key": "cus_anh-nghi-m-c-mau",
    "name": "Anh Nghiệm Cà Mau",
    "master_source": "kiotviet",
    "kiotviet_customer_id": null,
    "legacy_detected_from": "warranty_items.csv"
  },
  {
    "customer_key": "cus_anh-nguy-n-to-n",
    "name": "Anh Nguyễn Toàn",
    "master_source": "kiotviet",
    "kiotviet_customer_id": null,
    "legacy_detected_from": "warranty_items.csv"
  },
  {
    "customer_key": "cus_anh-nhi-ng-th-p",
    "name": "Anh Nhi (Đồng Tháp)",
    "master_source": "kiotviet",
    "kiotviet_customer_id": null,